{
  "clientId": "harbour-plumbing",
  "transcript": {
    "path": "transcript/intake-2026-10-01.vtt",
    "format": "vtt",
    "sha256": "87a32f53318544a7dd48b4c6c3c46fcea8671fd848f82c2da0f3e6cf7ebf5cc0"
  },
  "documents": [
    {
      "id": "D-01",
      "path": "documents/01-invoice-INV-2041.pdf",
      "kind": "pdf",
      "sha256": "8d361fcfc4770e2d788dcee76ce5b90e904528231bb1391b8bae14bd582b42eb"
    },
    {
      "id": "D-02",
      "path": "documents/02-invoice-INV-2047.pdf",
      "kind": "pdf",
      "sha256": "bf0537bb5283871fb90d5a98084bed96116613c04d70d629189568b8d41e5351"
    },
    {
      "id": "D-03",
      "path": "documents/03-invoice-INV-2052.pdf",
      "kind": "pdf",
      "sha256": "e9faa9b882efe5706b0552db77c0db8b21404cb0dd2719c47d94f557a203cca6"
    },
    {
      "id": "D-04",
      "path": "documents/04-email-invoice-INV-2041.eml",
      "kind": "eml",
      "sha256": "6549defd831dd8191126a8c8b18792d309abad619274c57e3972029a6a5bf394"
    },
    {
      "id": "D-05",
      "path": "documents/05-email-reminder-INV-2032.eml",
      "kind": "eml",
      "sha256": "bbbf8063e8990f5d0aa0081017c387ad9c5e91e141fff39a18038397edac59ce"
    },
    {
      "id": "D-06",
      "path": "documents/06-email-work-order-WO-55812.eml",
      "kind": "eml",
      "sha256": "797f59042ef31a3778508fe84ddaa3970cc0e6763567a52f1b092b105f846210"
    },
    {
      "id": "D-07",
      "path": "documents/07-email-receipts-2026-09.eml",
      "kind": "eml",
      "sha256": "646cbcee48bd5f6187908af4a440270af9781bdf91b0f2ab9762f77457f49ffa"
    },
    {
      "id": "D-08",
      "path": "documents/08-email-dispute-INV-2039.eml",
      "kind": "eml",
      "sha256": "d77bc922fc27913dd736c6d1867fc70b5446100ffd75fa982c4abd7accdb5d6a"
    },
    {
      "id": "D-09",
      "path": "documents/09-rates-and-timesheet.xlsx",
      "kind": "xlsx",
      "sha256": "4bfaa84e1899654a893d883e93b5ac1a8cad4e365c1829619450d5dca6a3b347"
    }
  ],
  "redaction": "not_started",
  "items": [
    {
      "kind": "transcript_segment",
      "id": "T-0001",
      "speaker": "Interviewer",
      "start": "00:00:04.000",
      "end": "00:00:17.860",
      "text": "Before we start, this call is being recorded so we can write up how the business runs. The recording is only used by Me² for that. Are you both happy to go ahead?"
    },
    {
      "kind": "transcript_segment",
      "id": "T-0002",
      "speaker": "Dana Whitlock",
      "start": "00:00:19.360",
      "end": "00:00:21.360",
      "text": "Yep, all good."
    },
    {
      "kind": "transcript_segment",
      "id": "T-0003",
      "speaker": "Priya Raman",
      "start": "00:00:22.860",
      "end": "00:00:24.860",
      "text": "Yes, that's fine."
    },
    {
      "kind": "transcript_segment",
      "id": "T-0004",
      "speaker": "Interviewer",
      "start": "00:00:26.360",
      "end": "00:00:30.560",
      "text": "Great. Dana, give me the thirty-second version of the business."
    },
    {
      "kind": "transcript_segment",
      "id": "T-0005",
      "speaker": "Dana Whitlock",
      "start": "00:00:32.060",
      "end": "00:00:47.180",
      "text": "Harbour Plumbing and Gas. Mostly residential, some strata work, and a fair bit for real estate agents, maintenance on rentals. It's me, three techs and an apprentice, and Priya runs the office three days a week."
    },
    {
      "kind": "transcript_segment",
      "id": "T-0006",
      "speaker": "Interviewer",
      "start": "00:00:48.680",
      "end": "00:00:53.720",
      "text": "Let's start with money coming in. What happens when a job's finished?"
    },
    {
      "kind": "transcript_segment",
      "id": "T-0007",
      "speaker": "Dana Whitlock",
      "start": "00:00:55.220",
      "end": "00:01:02.780",
      "text": "The tech closes the job in JobLog on their phone. Photos, parts used, hours. Then Priya invoices it."
    },
    {
      "kind": "transcript_segment",
      "id": "T-0008",
      "speaker": "Priya Raman",
      "start": "00:01:04.280",
      "end": "00:01:25.280",
      "text": "Usually the next morning. I open the completed jobs list in JobLog and for each one I create the invoice in Xero. Parts come off the job sheet, and I price them from the price list spreadsheet, not from what the tech typed, because they never put the markup on."
    },
    {
      "kind": "transcript_segment",
      "id": "T-0009",
      "speaker": "Interviewer",
      "start": "00:01:26.780",
      "end": "00:01:28.780",
      "text": "And labour?"
    },
    {
      "kind": "transcript_segment",
      "id": "T-0010",
      "speaker": "Priya Raman",
      "start": "00:01:30.280",
      "end": "00:01:40.360",
      "text": "Call-out fee plus hours at the standard rate. After hours is a different call-out fee, that's on the price list as its own line."
    },
    {
      "kind": "transcript_segment",
      "id": "T-0011",
      "speaker": "Priya Raman",
      "start": "00:01:41.860",
      "end": "00:01:51.100",
      "text": "Then I email it from the accounts inbox. Same wording every time, there's a template in Xero. Payment terms are fourteen days."
    },
    {
      "kind": "transcript_segment",
      "id": "T-0012",
      "speaker": "Dana Whitlock",
      "start": "00:01:52.600",
      "end": "00:02:06.040",
      "text": "Unless it's an agency job. Then the invoice goes to the agency, not the tenant, and it has to have their work order number on it or they just bounce it back."
    },
    {
      "kind": "transcript_segment",
      "id": "T-0013",
      "speaker": "Priya Raman",
      "start": "00:02:07.540",
      "end": "00:02:23.080",
      "text": "And strata want the strata plan number in the reference. Except when it's an emergency call-out, sometimes there's no work order yet, so I email the property manager and ask for one before I send the invoice."
    },
    {
      "kind": "transcript_segment",
      "id": "T-0014",
      "speaker": "Interviewer",
      "start": "00:02:24.580",
      "end": "00:02:27.100",
      "text": "How long does invoicing take you?"
    },
    {
      "kind": "transcript_segment",
      "id": "T-0015",
      "speaker": "Priya Raman",
      "start": "00:02:28.600",
      "end": "00:02:42.040",
      "text": "Five to ten minutes a job if the job sheet's complete. If the tech hasn't put the parts in I have to ring them, and that can hold it up a day."
    },
    {
      "kind": "transcript_segment",
      "id": "T-0016",
      "speaker": "Interviewer",
      "start": "00:02:43.540",
      "end": "00:02:46.060",
      "text": "What happens if someone doesn't pay?"
    },
    {
      "kind": "transcript_segment",
      "id": "T-0017",
      "speaker": "Priya Raman",
      "start": "00:02:47.560",
      "end": "00:02:57.640",
      "text": "Every Monday I run the aged receivables report in Xero. Anything a week overdue gets a friendly reminder email. I've got a standard one."
    },
    {
      "kind": "transcript_segment",
      "id": "T-0018",
      "speaker": "Priya Raman",
      "start": "00:02:59.140",
      "end": "00:03:03.760",
      "text": "At thirty days I ring them. Most people have just forgotten."
    },
    {
      "kind": "transcript_segment",
      "id": "T-0019",
      "speaker": "Dana Whitlock",
      "start": "00:03:05.260",
      "end": "00:03:19.540",
      "text": "And anything over two thousand dollars that's more than forty-five days overdue comes to me. I decide whether it goes to the debt collector or I ring them myself. Priya doesn't make that call."
    },
    {
      "kind": "transcript_segment",
      "id": "T-0020",
      "speaker": "Interviewer",
      "start": "00:03:21.040",
      "end": "00:03:23.560",
      "text": "Does anyone ever dispute an invoice?"
    },
    {
      "kind": "transcript_segment",
      "id": "T-0021",
      "speaker": "Dana Whitlock",
      "start": "00:03:25.060",
      "end": "00:03:38.080",
      "text": "Now and then. If someone's unhappy with the bill, that comes straight to me. I'd rather sort it out on the phone than have it go back and forth on email."
    },
    {
      "kind": "transcript_segment",
      "id": "T-0022",
      "speaker": "Interviewer",
      "start": "00:05:14.580",
      "end": "00:05:17.940",
      "text": "OK. Wages. How do the techs get paid?"
    },
    {
      "kind": "transcript_segment",
      "id": "T-0023",
      "speaker": "Priya Raman",
      "start": "00:05:19.440",
      "end": "00:05:30.360",
      "text": "They fill in the timesheet tab in the spreadsheet by Monday morning. Start, finish, breaks. The sheet works out the hours and any overtime over thirty-eight."
    },
    {
      "kind": "transcript_segment",
      "id": "T-0024",
      "speaker": "Priya Raman",
      "start": "00:05:31.860",
      "end": "00:05:42.360",
      "text": "I compare the hours against the jobs in JobLog, because sometimes the timesheet says eight hours and JobLog says they were on site for five."
    },
    {
      "kind": "transcript_segment",
      "id": "T-0025",
      "speaker": "Priya Raman",
      "start": "00:05:43.860",
      "end": "00:05:51.420",
      "text": "Then I put the pay run into Xero on Tuesday and Dana approves it in the Xero app."
    },
    {
      "kind": "transcript_segment",
      "id": "T-0026",
      "speaker": "Dana Whitlock",
      "start": "00:05:52.920",
      "end": "00:06:06.360",
      "text": "Pay day is Wednesday. If the timesheet and JobLog are more than an hour apart for anyone, Priya flags it to me before the pay run and I talk to the tech."
    },
    {
      "kind": "transcript_segment",
      "id": "T-0027",
      "speaker": "Interviewer",
      "start": "00:06:07.860",
      "end": "00:06:09.860",
      "text": "What about the apprentice?"
    },
    {
      "kind": "transcript_segment",
      "id": "T-0028",
      "speaker": "Priya Raman",
      "start": "00:06:11.360",
      "end": "00:06:22.700",